{"$schema":"https://json-schema.org/draft/2020-12/schema","$id":"https://ontology-dashboard.local/schemas/system-impact-analysis-request.schema.json","type":"object","additionalProperties":false,"required":["mapping_id","mapping_version","mapping_sha256","rebuild_job_id","include_stages"],"properties":{"mapping_id":{"type":"string","pattern":"^[A-Za-z0-9][A-Za-z0-9._-]{0,159}$"},"mapping_version":{"type":"string","pattern":"^[A-Za-z0-9][A-Za-z0-9._-]{0,159}$"},"mapping_sha256":{"type":"string","pattern":"^(?!0{64}$)[a-f0-9]{64}$"},"rebuild_job_id":{"type":"string","format":"uuid"},"include_stages":{"type":"array","minItems":1,"uniqueItems":true,"items":{"enum":["preprocessing","feature","training"]}}}}
